{
  "keys": ["device:<branch-user>", "site:<branch>"],
  "schema": "inventory-network/v1",
  "updated_at": "2026-10-25T23:40:00Z",
  "source_agent": "caldera-mcp",
  "devices": [
    {
      "name": "<branch-user>",
      "site": "<branch>",
      "role": "host",
      "group": "<branch>",
      "addresses": ["<branch-user-ip>"]
    },
    {
      "name": "<edge>",
      "site": "<branch>",
      "role": "network",
      "group": null,
      "addresses": ["<edge-ip>"]
    }
  ],
  "services": [
    {
      "name": "<app>",
      "url": "http://<app-address>/",
      "address": "<app-address>",
      "port": 80,
      "site": "<dc>"
    }
  ]
}
